SQL> create table tbl_employee(eid number(5),ename varchar2(7),esalary number(6));

Table created.

SQL> insert into tbl_employee values(101,'JB',2000);

1 row created.

SQL> insert into tbl_employee values(102,'surya',3000);

1 row created.

SQL> insert into tbl_employee values(103,'sanjay',4000);

1 row created.

SQL> insert into tbl_employee values(104,'kavin',5000);

1 row created.

SQL> insert into tbl_employee values(105,'vijay',6000);

1 row created.

SQL> select * from tbl_employee
  2
SQL> select * from tbl_employee;

       EID ENAME      ESALARY
---------- ------- ----------
       101 JB            2000
       102 surya         3000
       103 sanjay        4000
       104 kavin         5000
       105 vijay         6000

SQL> select *from tbl_employee where eid in(101,103,105) and esalary>4000;

       EID ENAME      ESALARY
---------- ------- ----------
       105 vijay         6000

SQL> select *from tbl_employee where eid in(101,103,105) or esalary>4000;

       EID ENAME      ESALARY
---------- ------- ----------
       101 JB            2000
       103 sanjay        4000
       104 kavin         5000
       105 vijay         6000

SQL> select *from tbl_employee where eid >103 and esalary <4000;

no rows selected

SQL> select *from tbl_employee where eid >103 or esalary <4000;

       EID ENAME      ESALARY
---------- ------- ----------
       101 JB            2000
       102 surya         3000
       104 kavin         5000
       105 vijay         6000

SQL> insert into tbl_employee (eid,esalary) values (106,3000);

1 row created.

SQL> select * from tbl_employee;

       EID ENAME      ESALARY
---------- ------- ----------
       101 JB            2000
       102 surya         3000
       103 sanjay        4000
       104 kavin         5000
       105 vijay         6000
       106               3000

6 rows selected.

SQL> select *from tbl_employee where ename is null;

       EID ENAME      ESALARY
---------- ------- ----------
       106               3000

SQL> select *from tbl_employee where ename is not null;

       EID ENAME      ESALARY
---------- ------- ----------
       101 JB            2000
       102 surya         3000
       103 sanjay        4000
       104 kavin         5000
       105 vijay         6000

SQL> select *from tbl_employee where ename like 'a%';

no rows selected

SQL> select *from tbl_employee where ename like 's%';

       EID ENAME      ESALARY
---------- ------- ----------
       102 surya         3000
       103 sanjay        4000

SQL> select *from tbl_employee where ename like '__a%';

no rows selected

SQL> select *from tbl_employee where ename like '_a%';

       EID ENAME      ESALARY
---------- ------- ----------
       103 sanjay        4000
       104 kavin         5000

SQL> select *from tbl_employee where ename like '__%y';

       EID ENAME      ESALARY
---------- ------- ----------
       103 sanjay        4000
       105 vijay         6000

SQL> select *from tbl_employee where ename like '%a%';

       EID ENAME      ESALARY
---------- ------- ----------
       102 surya         3000
       103 sanjay        4000
       104 kavin         5000
       105 vijay         6000

SQL> select *from tbl_employee where ename not like '%a%';

       EID ENAME      ESALARY
---------- ------- ----------
       101 JB            2000

SQL> select * from tbl_employee order by eid desc;

       EID ENAME      ESALARY
---------- ------- ----------
       106               3000
       105 vijay         6000
       104 kavin         5000
       103 sanjay        4000
       102 surya         3000
       101 JB            2000

6 rows selected.

SQL> alter table tbl_employee add doj date;

Table altered.

SQL> desc tbl_employee
 Name                                      Null?    Type
 ----------------------------------------- -------- ----------------------------
 EID                                                NUMBER(5)
 ENAME                                              VARCHAR2(7)
 ESALARY                                            NUMBER(6)
 DOJ                                                DATE

SQL> select * from tbl_employee;

       EID ENAME      ESALARY DOJ
---------- ------- ---------- ---------
       101 JB            2000
       102 surya         3000
       103 sanjay        4000
       104 kavin         5000
       105 vijay         6000
       106               3000

6 rows selected.

SQL> update tbl_employee set doj=sysdate where eid=103;

1 row updated.

SQL> select * from tbl_employee;

       EID ENAME      ESALARY DOJ
---------- ------- ---------- ---------
       101 JB            2000
       102 surya         3000
       103 sanjay        4000 07-AUG-24
       104 kavin         5000
       105 vijay         6000
       106               3000

6 rows selected.

SQL> update tbl_employee set doj='05-aug-24' where eid in(101,105);

2 rows updated.

SQL> update tbl_employee set doj='06-aug-24' where eid in(102,104,106);

3 rows updated.

SQL> select * from tbl_employee;

       EID ENAME      ESALARY DOJ
---------- ------- ---------- ---------
       101 JB            2000 05-AUG-24
       102 surya         3000 06-AUG-24
       103 sanjay        4000 07-AUG-24
       104 kavin         5000 06-AUG-24
       105 vijay         6000 05-AUG-24
       106               3000 06-AUG-24

6 rows selected.

SQL> alter taable tbl_employee drop column doj;
alter taable tbl_employee drop column doj
      *
ERROR at line 1:
ORA-00940: invalid ALTER command


SQL> alter table tbl_employee drop column doj;

Table altered.

SQL> select * from tbl_employee;

       EID ENAME      ESALARY
---------- ------- ----------
       101 JB            2000
       102 surya         3000
       103 sanjay        4000
       104 kavin         5000
       105 vijay         6000
       106               3000

6 rows selected.

SQL> alter table tbl_employee modify esalary number(7);

Table altered.

SQL> desc tbl_employee;
 Name                                      Null?    Type
 ----------------------------------------- -------- ----------------------------
 EID                                                NUMBER(5)
 ENAME                                              VARCHAR2(7)
 ESALARY                                            NUMBER(7)

SQL> alter table tbl_employee rename column eid to id;

Table altered.

SQL> desc tbl_employee;
 Name                                      Null?    Type
 ----------------------------------------- -------- ----------------------------
 ID                                                 NUMBER(5)
 ENAME                                              VARCHAR2(7)
 ESALARY                                            NUMBER(7)

SQL> rename table tbl_employee to tbl_emp;
rename table tbl_employee to tbl_emp
       *
ERROR at line 1:
ORA-00903: invalid table name


SQL> rename tbl_employee to tbl_emp;

Table renamed.

SQL> desc tbl_emp;
 Name                                      Null?    Type
 ----------------------------------------- -------- ----------------------------
 ID                                                 NUMBER(5)
 ENAME                                              VARCHAR2(7)
 ESALARY                                            NUMBER(7)

SQL>